word	phones
philharmonic	f ɪ l h ɑ ɹ m ɑ n ɪ k
latin	l æ t ə n
abu	æ b uː
awaits	ə w eɪ t s
sparkles	s p ɑ ɹ k ə l z
harpercollins	h ɑ ɹ p ə ɹ k ɔ l ɪ n z
published	p ʌ b l ɪ ʃ t
soaring	s ɔ ɹ ɪ ŋ
apparel	ə p æ ɹ ə l
bathe	b eɪ ð
midtown	m ɪ d t aʊ n
abused	ə b j uː z d
descent	d ɪ s ɛ n t
rename	ɹ iː n eɪ m
wildflower	w aɪ l d f l aʊ ə ɹ
briar	b ɹ aɪ ə ɹ
bicycles	b aɪ s ɪ k ə l z
titans	t aɪ t ə n z
dallas	d æ l ə s
purist	p j ʊ ɹ ɪ s t
downtown	d aʊ n t aʊ n
uptown	ʌ p t aʊ n
fireworks	f aɪ ɹ w ɜː k s
baths	b æ θ s
offended	ə f ɛ n d ə d
opal	oʊ p ə l
sweetened	s w iː t ə n d
curses	k ɜː s ɪ z
pricks	p ɹ ɪ k s
cools	k uː l z
linen	l ɪ n ə n
descended	d ɪ s ɛ n d ə d
phillip	f ɪ l ɪ p
obsessing	ə b s ɛ s ɪ ŋ
defeats	d ɪ f iː t s
scotland	s k ɑ t l ə n d
reunions	ɹ iː uː n j ə n z
uneventful	ʌ n iː v ɛ n t f ə l
ancient	eɪ n tʃ ə n t
romance	ɹ oʊ m æ n s
longing	l ɔ ŋ ɪ ŋ
woodland	w ʊ d l æ n d
dusting	d ʌ s t ɪ ŋ
worlds	w ɜː l d z
beards	b ɪ ɹ d z
summertime	s ʌ m ə ɹ t aɪ m
heartbroken	h ɑ ɹ t b ɹ oʊ k ə n
spirit	s p ɪ ɹ ə t
delayed	d ɪ l eɪ d
dusted	d ʌ s t ɪ d
shaved	ʃ eɪ v d
bathed	b eɪ ð d
showered	ʃ aʊ ə ɹ d
backing	b æ k ɪ ŋ
bra	b ɹ ɑ
soften	s ɑ f ə n
briefs	b ɹ iː f s
speckles	s p ɛ k l z
trims	t ɹ ɪ m z
roasted	ɹ oʊ s t ə d
aching	eɪ k ɪ ŋ
undershirts	ʌ n d ə ɹ ʃ ɜː t s
strings	s t ɹ ɪ ŋ z
brute	b ɹ uː t
silk	s ɪ l k
garters	ɡ ɑ ɹ t ə ɹ z
snorting	s n ɔ ɹ t ɪ ŋ
clumsy	k l ʌ m z iː
petticoats	p ɛ t iː k oʊ t s
stockings	s t ɑ k ɪ ŋ z
panty	p æ n t iː
pinching	p ɪ n tʃ ɪ ŋ
adventurous	æ d v ɛ n tʃ ə ɹ ə s
impulsive	ɪ m p ʌ l s ɪ v
workshop	w ɜː k ʃ ɑ p
sleeved	s l iː v d
snort	s n ɔ ɹ t
trousers	t ɹ aʊ z ə ɹ z
streaked	s t ɹ iː k t
ruffles	ɹ ʌ f ə l z
links	l ɪ ŋ k s
cuff	k ʌ f
fasten	f æ s ə n
cuffs	k ʌ f s
cummerbund	k ʌ m ə b ʌ n d
tuxedo	t ʌ k s iː d oʊ
contoured	k ɑ n t ʊ ɹ d
belts	b ɛ l t s
garnets	ɡ ɑ n ɪ t s
composer	k ə m p oʊ z ə ɹ
garnet	ɡ ɑ ɹ n ə t
crock	k ɹ ɑ k
consults	k ə n s ʌ l t s
claims	k l eɪ m z
skirts	s k ɜː t s
shipwrecks	ʃ ɪ p ɹ ɛ k s
temptation	t ɛ m t eɪ ʃ ə n
infested	ɪ n f ɛ s t ɪ d
blouses	b l aʊ s ə z
brim	b ɹ ɪ m
jumper	dʒ ʌ m p ə ɹ
forbids	f ə ɹ b ɪ d z
bracelets	b ɹ eɪ s l ɪ t s
taxied	t æ k s iː d
dale's	d eɪ l z
sprayed	s p ɹ eɪ d
seaweeds	s iː w iː d z
corals	k ɔ ɹ ə l z
stalks	s t ɔ k s
deliveries	d ɪ l ɪ v ə ɹ iː z
refueled	ɹ iː f j uː ə l d
ties	t aɪ z
divides	d ɪ v aɪ d z
alana	ɑ l æ n ə
adela	ə d ɛ l ə
discussed	d ɪ s k ʌ s t
slug	s l ʌ ɡ
jetsam	dʒ ɛ t s ə m
flotsam	f l ɑ t s ə m
memorized	m ɛ m ə ɹ aɪ z d
spies	s p aɪ z
extract	ɛ k s t ɹ æ k t
recite	ɹ ə s aɪ t
advantage	æ d v æ n t ɪ dʒ
slugged	s l ʌ ɡ d
lincoln	l ɪ ŋ k ə n
smiley	s m aɪ l iː
fails	f eɪ l z
lapels	l ə p ɛ l z
satin	s æ t ə n
mitten	m ɪ t ə n
rubbers	ɹ ʌ b ə ɹ z
caps	k æ p s
overcoats	oʊ v ə ɹ k oʊ t s
hanger	h æ ŋ ə ɹ
refuels	ɹ iː f j ʊ ə l z
jason	dʒ eɪ s ə n
cases	k eɪ s ə z
briefcase	b ɹ iː f k eɪ s
mani	m ɑ n iː
trudging	t ɹ ʌ dʒ ɪ ŋ
wives	w aɪ v z
husbands	h ʌ z b ə n d z
fathers	f ɑ ð ə ɹ z
calcium	k æ l s iː ə m
trudged	t ɹ ʌ dʒ d
chipmunk	tʃ ɪ p m ə ŋ k
ethnicity	ɛ θ n ɪ s ɪ t iː
mexican	m ɛ k s ə k ə n
gray's	ɡ ɹ eɪ z
asian	eɪ ʒ ə n
busses	b ʌ s ə z
subways	s ʌ b w eɪ z
jingling	dʒ ɪ ŋ ɡ l ɪ ŋ
tinkling	t ɪ ŋ k ə l ɪ ŋ
startled	s t ɑ ɹ t ə l d
blended	b l ɛ n d ɪ d
laddie	l æ d ɪ
velvet	v ɛ l v ə t
hums	h ʌ m z
snowfall	s n oʊ f ɑ l
sheepishly	ʃ iː p ɪ ʃ l iː
brains	b ɹ eɪ n z
atop	ə t ɑ p
chomped	tʃ ɑ m p t
redish	ɹ ɛ d ɪ ʃ
rafting	ɹ æ f t ɪ ŋ
dispenser	d ɪ s p ɛ n s ə ɹ
dino	d iː n oʊ
charged	tʃ ɑ ɹ dʒ d
twilight	t w aɪ l aɪ t
lava	l ɑ v ə
seekers	s iː k ə ɹ z
thrill	θ ɹ ɪ l
umpire	ʌ m p aɪ ə ɹ
abyss	ə b ɪ s
lockers	l ɑ k ə ɹ z
backstage	b æ k s t eɪ dʒ
earmuffs	ɪ ɹ m ʌ f s
burnt	b ɜː n t
smoky	s m oʊ k iː
volcanos	v ɑ l k eɪ n oʊ z
fossil	f ɑ s ə l
basses	b æ s ɪ z
violins	v aɪ ə l ɪ n z
quicksand	k w ɪ k s æ n d
viola	v aɪ oʊ l ə
pluto's	p l uː t oʊ z
harpist	h ɑ ɹ p ɪ s t
brink	b ɹ ɪ ŋ k
gong	ɡ ɔ ŋ
percussion	p ə ɹ k ʌ ʃ ə n
timpanists	t ɪ m p ə n ɪ s t s
hermit	h ɜː m ə t
acquaintance	ə k w eɪ n t ə n s
pleasure	p l ɛ ʒ ə ɹ
mallet	m æ l ɪ t
thing's	θ ɪ ŋ z
stools	s t uː l z
moray	m ə ɹ eɪ
barracuda	b ɛ ɹ ə k uː d ə
cuttlefish	k ʌ t ə l f ɪ ʃ
dominos	d ɑ m ɪ n oʊ z
rotten	ɹ ɑ t ə n
likely	l aɪ k l iː
ada's	eɪ d ə z
duties	d uː t iː z
troop	t ɹ uː p
honest	ɑ n ə s t
podium	p oʊ d iː ə m
excite	ɪ k s aɪ t
vinaigrette	v ɪ n ɪ ɡ ɹ ɛ t
applauds	ə p l ɔ d z
thorny	θ ɔ ɹ n iː
eels	iː l z
baton	b ə t ɑ n
loosen	l uː s ə n
petrie	p ɛ t ɹ iː
terrified	t ɛ ɹ ə f aɪ d
ada	eɪ d ə
admit	ə d m ɪ t
handlebar	h æ n d ə l b ɑ ɹ
petrie's	p ɛ t ɹ iː z
invent	ɪ n v ɛ n t
inventor	ɪ n v ɛ n t ə ɹ
harvesting	h ɑ ɹ v ə s t ɪ ŋ
invented	ɪ n v ɛ n t ə d
hibiscus	h ɪ b ɪ s k ə s
polo	p oʊ l oʊ
arriving	ə ɹ aɪ v ɪ ŋ
silently	s aɪ l ə n t l iː
jogs	dʒ ɑ ɡ z
threatened	θ ɹ ɛ t ə n d
nightmare	n aɪ t m ɛ ɹ
worst	w ɜː s t
chandelier	ʃ æ n d ə l ɪ ɹ
instance	ɪ n s t ə n s
suburbs	s ʌ b ə ɹ b z
urchins	ɜː tʃ ə n z
attackers	ə t æ k ə ɹ z
ward	w ɔ ɹ d
spines	s p aɪ n z
curry	k ʌ ɹ iː
cellos	tʃ ɛ l oʊ z
violas	v iː oʊ l ə z
piccolo	p ɪ k ə l oʊ
flutes	f l uː t s
oboe	oʊ b oʊ
clarinet	k l ɛ ɹ ə n ɛ t
inner	ɪ n ə ɹ
campus	k æ m p ə s
schedule	s k ɛ dʒ ʊ l
warrior	w ɔ ɹ iː ə ɹ
symphony	s ɪ m f ə n iː
roughest	ɹ ʌ f ə s t
cleft	k l ɛ f t
loaves	l oʊ v z
meanest	m iː n ə s t
pterodactyls	t ɛ ɹ oʊ d æ k t ɪ l z
flea	f l iː
hopkins	h ɑ p k ɪ n z
cranberries	k ɹ æ n b ɛ ɹ iː z
hok	h ɔ k
lok	l ɑ k
siew	s uː
seahorses	s iː h ɔ s ɪ z
monks	m ʌ ŋ k s
scorpion	s k ɔ ɹ p iː ə n
monk	m ʌ ŋ k
packing	p æ k ɪ ŋ
marlin	m ɑ ɹ l ə n
beth	b ɛ θ
mildewy	m ɪ l d j uː ɪ
mammals	m æ m ə l z
blooded	b l ʌ d ɪ d
mandarin	m æ n d ə ɹ ə n
oily	ɔɪ l iː
cus	k ʌ s
versus	v ɜː s ə s
confirm	k ə n f ɜː m
regulate	ɹ ɛ ɡ j ə l eɪ t
idioms	ɪ d iː ə m z
viper	v aɪ p ə ɹ
chuckie	tʃ ʌ k iː
weary	w ɪ ɹ iː
famine	f æ m ə n
suspicious	s ə s p ɪ ʃ ə s
carpenter	k ɑ ɹ p ə n t ə ɹ
seamstress	s iː m s t ɹ ɪ s
scholar	s k ɑ l ə ɹ
merchant	m ɜː tʃ ə n t
jenny's	dʒ ɛ n iː z
agrees	ə ɡ ɹ iː z
smiles	s m aɪ l z
shrek	ʃ ɹ ɛ k
mixture	m ɪ k s tʃ ə ɹ
amphibian	æ m f ɪ b iː ə n
decked	d ɛ k t
defecate	d ɛ f ə k eɪ t
hues	h j uː z
autumnal	ɔ t ʌ m n ə l
coals	k oʊ l z
pock	p ɑ k
drifted	d ɹ ɪ f t ə d
tragedy	t ɹ æ dʒ ə d iː
curiosity	k j ʊ ɹ iː ɑ s ə t iː
seasoned	s iː z ə n d
shellfish	ʃ ɛ l f ɪ ʃ
spices	s p aɪ s ə z
eaters	iː t ə ɹ z
deedee	d iː d iː
speech	s p iː tʃ
bubbling	b ʌ b ə l ɪ ŋ
agreeable	ə ɡ ɹ iː ə b ə l
taping	t eɪ p ɪ ŋ
pods	p ɑ d z
cabbages	k æ b ɪ dʒ ɪ z
dentures	d ɛ n tʃ ə ɹ z
among	ə m ʌ ŋ
angie	æ n dʒ iː
richer	ɹ ɪ tʃ ə ɹ
villager	v ɪ l ɪ dʒ ə ɹ
dumplings	d ʌ m p l ɪ ŋ z
emperor	ɛ m p ə ɹ ə ɹ
bacteria	b æ k t ɪ ɹ iː ə
sulfide	s ʌ l f aɪ d
casings	k eɪ s ɪ ŋ z
curds	k ɜː d z
clams	k l æ m z
taro	t ɛ ɹ oʊ
current	k ɜː ə n t
sparks	s p ɑ ɹ k s
groove	ɡ ɹ uː v
electrified	ɪ l ɛ k t ɹ ə f aɪ d
intensified	ɪ n t ɛ n s ə f aɪ d
gino	dʒ iː n oʊ
elaborate	ɪ l æ b ɹ ə t
scrubbers	s k ɹ ʌ b ə ɹ z
jaws	dʒ ɔ z
barnacles	b ɑ ɹ n ə k ə l z
snapping	s n æ p ɪ ŋ
bungee	b ʌ n dʒ iː
returning	ɹ ɪ t ɜː n ɪ ŋ
spew	s p j uː
chimneys	tʃ ɪ m n iː z
vents	v ɛ n t s
chemical	k ɛ m ə k ə l
avocado	æ v ə k ɑ d oʊ
lanterns	l æ n t ə ɹ n z
lychee	l aɪ tʃ iː
buns	b ʌ n z
charmed	tʃ ɑ ɹ m d
banquet	b æ ŋ k w ə t
johnson	dʒ ɑ n s ə n
seventies	s ɛ v ə n t iː z
decade	d ɛ k eɪ d
unlocked	ə n l ɑ k t
willows	w ɪ l oʊ z
generous	dʒ ɛ n ə ɹ ə s
guests	ɡ ɛ s t s
betty's	b ɛ t iː z
tattoo	t æ t uː
barbies	b ɑ ɹ b iː z
versions	v ɜː ʒ ə n z
folklore	f oʊ k l ɔ ɹ
european	j ʊ ɹ ə p iː ə n
philippines	f ɪ l ə p iː n z
korea	k ɔ ɹ iː ə
jamaica	dʒ ə m eɪ k ə
belgium	b ɛ l dʒ ə m
sweden	s w iː d ə n
form	f ɔ ɹ m
retelling	ɹ iː t ɛ l ɪ ŋ
gain	ɡ eɪ n
seeking	s iː k ɪ ŋ
enlightenment	ɛ n l aɪ t ə n m ə n t
tricksters	t ɹ ɪ k s t ə ɹ z
tradition	t ɹ ə d ɪ ʃ ə n
buddhist	b uː d ə s t
misty	m ɪ s t iː
prominent	p ɹ ɑ m ə n ə n t
characters	k æ ɹ ə k t ə ɹ z
prosperity	p ɹ ɑ s p ɛ ɹ ə t iː
wealth	w ɛ l θ
health	h ɛ l θ
bestow	b ɪ s t oʊ
deities	d iː ə t iː z
hulk	h ʌ l k
fortune	f ɔ ɹ tʃ ə n
symbolizes	s ɪ m b ə l aɪ z ɪ z
wolk	w oʊ k
mutual	m j uː tʃ uː ə l
obstacles	ɑ b s t ə k ə l z
longevity	l ɔ n dʒ ɛ v ə t iː
will's	w ɪ l z
license	l aɪ s ə n s
lipper	l ɪ p ə ɹ
ruckus	ɹ ʌ k ə s
films	f ɪ l m z
slithery	s l ɪ ð ə ɹ ɪ
ferocious	f ə ɹ oʊ ʃ ə s
atlantica	æ t l æ n t ɪ k ə
trident	t ɹ aɪ d ə n t
included	ɪ n k l uː d ə d
ceramic	s ə ɹ æ m ɪ k
journals	dʒ ɜː n ə l z
defecating	d ɛ f ə k eɪ t ɪ ŋ
shelly	ʃ ɛ l iː
distinguished	d ɪ s t ɪ ŋ ɡ w ɪ ʃ t
epoch	ɛ p ə k
pleistocene	p l aɪ s t ə s iː n
dingle	d ɪ ŋ ɡ ə l
mastodon	m æ s t ə d ɔ n
vast	v æ s t
abundant	ə b ʌ n d ə n t
arranging	ə ɹ eɪ n dʒ ɪ ŋ
crusty	k ɹ ʌ s t iː
overboard	oʊ v ə ɹ b ɔ ɹ d
relatively	ɹ ɛ l ə t ɪ v l iː
baloney	b ə l oʊ n iː
enabled	ɛ n eɪ b ə l d
siberia	s aɪ b ɪ ɹ iː ə
tundra	t ʌ n d ɹ ə
preserved	p ɹ ə z ɜː v d
hunted	h ʌ n t ə d
lectured	l ɛ k tʃ ə ɹ d
kent	k ɛ n t
scientific	s aɪ ə n t ɪ f ɪ k
leoni	l ɛ oʊ n iː
skins	s k ɪ n z
pierce	p ɪ ɹ s
carnivores	k ɑ ɹ n ə v ɔ ɹ z
emily's	ɛ m ɪ l iː z
frying	f ɹ aɪ ɪ ŋ
herbivore	h ɜː b ɪ v ɔ ɹ
joanie	dʒ oʊ n iː
fossils	f ɑ s ə l z
obtain	ə b t eɪ n
refreshments	ɹ ə f ɹ ɛ ʃ m ə n t s
predators	p ɹ ɛ d ə t ə ɹ z
hoofed	h ʊ f t
hopscotch	h ɑ p s k ɑ tʃ
scanning	s k æ n ɪ ŋ
switzerland	s w ɪ t s ə ɹ l ə n d
cheddar	tʃ ɛ d ə ɹ
fundraising	f ʌ n d ɹ eɪ s ɪ ŋ
monterey	m ɑ n t ə ɹ eɪ
jacks	dʒ æ k s
brazil	b ɹ ə z ɪ l
individual	ɪ n d ə v ɪ dʒ ə w ə l
norway	n ɔ ɹ w eɪ
molds	m oʊ l d z
plural	p l ʊ ɹ ə l
hopes	h oʊ p s
justine	dʒ ə s t iː n
marc	m ɑ ɹ k
juliet	dʒ uː l iː ɛ t
ou	uː
checkup	tʃ ɛ k ʌ p
newsletter	n uː z l ɛ t ə ɹ
reptiles	ɹ ɛ p t aɪ l z
reflexes	ɹ iː f l ɛ k s ə z
siphoning	s aɪ f ə n ɪ ŋ
maintain	m eɪ n t eɪ n
effective	ɪ f ɛ k t ɪ v
progress	p ɹ ɑ ɡ ɹ ɛ s
silliness	s ɪ l iː n ə s
barbie	b ɑ ɹ b iː
predecessors	p ɹ ɛ d ə s ɛ s ə ɹ z
defiantly	d ɪ f aɪ ə n t l iː
unicorns	j uː n ɪ k ɔ n z
cowgirl	k aʊ ɡ ɜː l
lowered	l oʊ ə ɹ d
pills	p ɪ l z
mcintosh	m æ k ə n t ɔ ʃ
offered	ɔ f ə ɹ d
sniffing	s n ɪ f ɪ ŋ
contract	k ɑ n t ɹ æ k t
disney's	d ɪ z n iː z
disapproved	d ɪ s ə p ɹ uː v d
calamari	k ɑ l ɑ m ɑ ɹ iː
scolded	s k oʊ l d ɪ d
goldie	ɡ oʊ l d iː
sharpened	ʃ ɑ ɹ p ə n d
dreamily	d ɹ iː m ɪ l ɪ
rowboat	ɹ oʊ b oʊ t
lagoon	l ə ɡ uː n
choking	tʃ oʊ k ɪ ŋ
galloping	ɡ æ l ə p ɪ ŋ
injured	ɪ n dʒ ə ɹ d
understood	ʌ n d ə ɹ s t ʊ d
happier	h æ p iː ə ɹ
clutched	k l ʌ tʃ t
departs	d ɪ p ɑ ɹ t s
blowup	b l oʊ ʌ p
feelings	f iː l ɪ ŋ z
tiptoed	t ɪ p t oʊ d
marrying	m ɛ ɹ iː ɪ ŋ
spraying	s p ɹ eɪ ɪ ŋ
interrupted	ɪ n t ə ɹ ʌ p t ɪ d
snatched	s n æ tʃ t
loudly	l aʊ d l iː
pursuits	p ə ɹ s uː t s
intellectual	ɪ n t ə l ɛ k tʃ uː ə l
spillage	s p ɪ l ɪ dʒ
extras	ɛ k s t ɹ ə z
argue	ɑ ɹ ɡ j uː
fidgeting	f ɪ dʒ ə t ɪ ŋ
defeated	d ɪ f iː t ə d
selfishness	s ɛ l f ɪ ʃ n ə s
forgave	f ə ɹ ɡ eɪ v
blessing	b l ɛ s ɪ ŋ
jessie	dʒ ɛ s iː
dismount	d ɪ s m aʊ n t
assuming	ə s uː m ɪ ŋ
olds	oʊ l d z
flattened	f l æ t ə n d
bot	b ɔ t
leotards	l iː oʊ t ɑ d z
deciding	d ɪ s aɪ d ɪ ŋ
sorted	s ɔ ɹ t ɪ d
introductory	ɪ n t ɹ ə d ʌ k t ə ɹ iː
hawaiian	h ə w aɪ ə n
hysterical	h ɪ s t ɛ ɹ ɪ k ə l
wheezy	w iː z ɪ
nonstop	n ɑ n s t ɑ p
slay	s l eɪ
troupe	t ɹ uː p
phenomenal	f ə n ɑ m ə n ə l
however	h aʊ ɛ v ə ɹ
couches	k aʊ tʃ ɪ z
tackles	t æ k ə l z
fireball	f aɪ ə ɹ b ɔ l
anthill	æ n t h ɪ l
stanza	s t æ n z ə
atkins	æ t k ɪ n z
now's	n aʊ z
protein	p ɹ oʊ t iː n
husk	h ʌ s k
sassy	s æ s iː
composition	k ɑ m p ə z ɪ ʃ ə n
nurse's	n ɜː s ɪ z
healing	h iː l ɪ ŋ
braid	b ɹ eɪ d
limited	l ɪ m ə t ə d
catnip	k æ t n ɪ p
pegs	p ɛ ɡ z
benjamin	b ɛ n dʒ ə m ə n
informed	ɪ n f ɔ ɹ m d
frasier	f ɹ eɪ ʒ ə ɹ
brandon	b ɹ æ n d ə n
suspense	s ə s p ɛ n s
rate	ɹ eɪ t
chili	tʃ ɪ l iː
frederika	f ɹ eɪ d ɛ ɹ iː k ə
nordstrom	n ɔ ɹ d s t ɹ ə m
selection	s ə l ɛ k ʃ ə n
coincidence	k oʊ ɪ n s ɪ d ə n s
deck	d ɛ k
shuffle	ʃ ʌ f ə l
reported	ɹ iː p ɔ ɹ t ɪ d
boar	b ɔ ɹ
inquired	ɪ n k w aɪ ə ɹ d
pheasants	f ɛ z ə n t s
okapi	oʊ k ɑ p ɪ
tamarin	t æ m ə ɹ ə n
platforms	p l æ t f ɔ ɹ m z
raccoons	ɹ æ k uː n z
directed	d ə ɹ ɛ k t ə d
gurgled	ɡ ɜː ɡ l d
advised	æ d v aɪ z d
swifts	s w ɪ f t s
tapir	t eɪ p ə ə ɹ
storks	s t ɔ k s
flurried	f l ɜː iː d
gnu	n uː
chimed	tʃ aɪ m d
what've	w ʌ t ə v
nanna	n æ n ə
depressed	d ɪ p ɹ ɛ s t
stray	s t ɹ eɪ
neira	n ɛ ɹ ə
boys'	b ɔɪ z
recordable	ɹ ɪ k ɔ ɹ d ə b ə l
vermont's	v ə ɹ m ɑ n t s
pheasant	f ɛ z ə n t
state's	s t eɪ t s
tweezer	t w iː z ə ɹ
stinger	s t ɪ ŋ ə ɹ
comforter	k ʌ m f ə ɹ t ə ɹ
girls'	ɡ ɜː l z
sung	s ʌ ŋ
burbled	b ɜː b ə l d
pigtails	p ɪ ɡ t eɪ l z
antler	æ n t l ə ɹ
greece	ɡ ɹ iː s
becky	b ɛ k iː
oldest	oʊ l d ə s t
moms	m ɑ m z
expedition	ɛ k s p ə d ɪ ʃ ə n
numbered	n ʌ m b ə ɹ d
logical	l ɑ dʒ ɪ k ə l
so's	s oʊ z
zoos	z uː z
renewed	ɹ ɪ n uː d
co-op	k oʊ ɑ p
co	k oʊ
chose	tʃ oʊ z
teacups	t iː k ʌ p s
horse's	h ɔ ɹ s ə z
roaring	ɹ ɔ ɹ ɪ ŋ
antiques	æ n t iː k s
sixth	s ɪ k s θ
antique	æ n t iː k
twenties	t w ɛ n t iː z
martin's	m ɑ ɹ t ə n z
cheesecake	tʃ iː z k eɪ k
mario	m ɑ ɹ iː oʊ
aprons	eɪ p ɹ ə n z
grandchildren	ɡ ɹ æ n tʃ ɪ l d ɹ ə n
bulldog	b ʊ l d ɔ ɡ
newer	n uː ə ɹ
morbid	m ɔ ɹ b ə d
intrepid	ɪ n t ɹ ɛ p ə d
aircraft	ɛ ɹ k ɹ æ f t
kamikaze	k ɑ m ə k ɑ z iː
jets	dʒ ɛ t s
sounding	s aʊ n d ɪ ŋ
copilot	k oʊ p aɪ l ə t
simulated	s ɪ m j ə l eɪ t ɪ d
controls	k ə n t ɹ oʊ l z
petri	p ɛ t ɹ iː
empire	ɛ m p aɪ ə ɹ
observation	ɑ b z ə ɹ v eɪ ʃ ə n
flattens	f l æ t n z
camper	k æ m p ə ɹ
expeditions	ɛ k s p ə d ɪ ʃ ə n z
graham's	ɡ ɹ eɪ ə m z
sworn	s w ɔ ɹ n
liberty's	l ɪ b ə ɹ t iː z
snowstorm	s n oʊ s t ɔ ɹ m
memorial	m ə m ɔ ɹ iː ə l
federal	f ɛ d ə ɹ ə l
joked	dʒ oʊ k t
froze	f ɹ oʊ z
schwartz	ʃ w ɔ ɹ t s
portraits	p ɔ ɹ t ɹ ə t s
teachers	t iː tʃ ə ɹ z
napped	n æ p t
algae	æ l dʒ iː
designed	d ɪ z aɪ n d
answer's	æ n s ə ɹ z
tambourines	t æ m b ə ɹ iː n z
kelp	k ɛ l p
strummed	s t ɹ ʌ m d
titanic	t aɪ t æ n ɪ k
revolution	ɹ ɛ v ə l uː ʃ ə n
sailors	s eɪ l ə ɹ z
immigrants	ɪ m ə ɡ ɹ ə n t s
ellis	ɛ l ɪ s
staten	s t æ t ə n
lunchroom	l ʌ n tʃ ɹ uː m
inking	ɪ ŋ k ɪ ŋ
imitation	ɪ m ə t eɪ ʃ ə n
torch	t ɔ ɹ tʃ
masses	m æ s ə z
plankton	p l æ ŋ k t ə n
alta	ɑ l t ə
arranged	ə ɹ eɪ n dʒ d
brief	b ɹ iː f
swell	s w ɛ l
semester	s ə m ɛ s t ə ɹ
seventh	s ɛ v ə n θ
fingernails	f ɪ ŋ ɡ ə ɹ n eɪ l z
postcard	p oʊ s t k ɑ ɹ d
example	ɪ ɡ z æ m p ə l
hind	h aɪ n d
partying	p ɑ ɹ t iː ɪ ŋ
fossilized	f ɑ s ə l aɪ z d
joan	dʒ oʊ n
plastered	p l æ s t ə ɹ d
husband's	h ʌ z b ə n d z
evolved	ɪ v ɑ l v d
plaza	p l ɑ z ə
orion	oʊ ɹ aɪ ə n
plaza's	p l ɑ z ə z
astronomers	ə s t ɹ ɑ n ə m ə ɹ z
represents	ɹ ɛ p ɹ ɪ z ɛ n t s
sphere	s f ɪ ɹ
missile	m ɪ s ə l
groupings	ɡ ɹ uː p ɪ ŋ z
universe	j uː n ə v ɜː s
simulation	s ɪ m j ə l eɪ ʃ ə n
darkens	d ɑ k ə n z
tiles	t aɪ l z
stairwell	s t ɛ ɹ w ɛ l
junior	dʒ uː n j ə ɹ
demise	d ɪ m aɪ z
antennae	æ n t ɛ n iː
carson	k ɑ ɹ s ə n
daniel	d æ n j ə l
prancing	p ɹ æ n s ɪ ŋ
graffiti	ɡ ɹ ə f iː t iː
hieroglyphics	h aɪ ɹ oʊ ɡ l ɪ f ɪ k s
temple	t ɛ m p ə l
charms	tʃ ɑ ɹ m z
sacred	s eɪ k ɹ ə d
parent	p ɛ ɹ ə n t
attacked	ə t æ k t
harlem	h ɑ ɹ l ə m
incense	ɪ n s ɛ n s
elm	ɛ l m
duster	d ʌ s t ə ɹ
pillar	p ɪ l ə ɹ
slab	s l æ b
apollo	ə p ɑ l oʊ
amateur	æ m ə t ɜː
scrubber	s k ɹ ʌ b ə ɹ
greenwich	ɡ ɹ ɛ n ɪ tʃ
treating	t ɹ iː t ɪ ŋ
intake	ɪ n t eɪ k
ghoul	ɡ uː l
chinatown	tʃ aɪ n ə t aʊ n
feasts	f iː s t s
brides	b ɹ aɪ d z
temples	t ɛ m p ə l z
booths	b uː θ s
marathon	m ɛ ɹ ə θ ɑ n
runners	ɹ ʌ n ə ɹ z
croaked	k ɹ oʊ k t
boroughs	b ɜː oʊ z
rockettes	ɹ ɑ k ɛ t s
holidays	h ɑ l ə d eɪ z
pulitzer	p ʊ l ə t s ə ɹ
gob	ɡ ɑ b
macy's	m eɪ s iː z
broadway	b ɹ ɔ d w eɪ
rockefeller	ɹ ɑ k ə f ɛ l ə ɹ
prometheus	p ɹ ə m iː θ iː ə s
marquee	m ɑ ɹ k iː
marriott	m ɛ ɹ iː ə t
auld	ɔ l d
america	ə m ɛ ɹ ə k ə
screens	s k ɹ iː n z
yorker	j ɔ ɹ k ə ɹ
schoolmates	s k uː l m eɪ t s
softest	s ɔ f t ə s t
confusing	k ə n f j uː z ɪ ŋ
telescope's	t ɛ l ə s k oʊ p s
outfitters	aʊ t f ɪ t ə ɹ z
urban	ɜː b ə n
hoppa	h ɑ p ə
regress	ɹ iː ɡ ɹ ɛ s
manny's	m æ n iː z
law's	l ɔ z
disliked	d ɪ s l aɪ k t
tormenting	t ɔ ɹ m ɛ n t ɪ ŋ
originally	ə ɹ ɪ dʒ ə n ə l iː
affordable	ə f ɔ ɹ d ə b ə l
secondly	s ɛ k ə n d l iː
boston's	b ɔ s t ə n z
wine's	w aɪ n z
thins	θ ɪ n z
cabin	k æ b ə n
rains	ɹ eɪ n z
abide	ə b aɪ d
extravaganza	ɛ k s t ɹ æ v ə ɡ æ n z ə
ode	oʊ d
poetry	p oʊ ə t ɹ iː
squids	s k w ɪ d z
facts	f æ k t s
backbone	b æ k b oʊ n
backbones	b æ k b oʊ n z
mollusks	m ɑ l ə s k s
stilly	s t ɪ l ɪ
sperm	s p ɜː m
tenfold	t ɛ n f oʊ l d
increased	ɪ n k ɹ iː s t
colloquial	k ə l oʊ k w iː ə l
slang	s l æ ŋ
teaches	t iː tʃ ə z
probability	p ɹ ɑ b ə b ɪ l ə t iː
intersperse	ɪ n t ə ɹ s p ɜː s
attitude	æ t ə t uː d
florida's	f l ɔ ɹ ɪ d ə z
snoozing	s n uː z ɪ ŋ
cornfield	k ɔ ɹ n f iː l d
tortillas	t ɔ ɹ t iː ə z
tortilla	t ɔ ɹ t iː ə
ballooning	b ə l uː n ɪ ŋ
rollercoaster	ɹ oʊ l ə ɹ k oʊ s t ə ɹ
gradual	ɡ ɹ æ dʒ uː ə l
reporting	ɹ iː p ɔ ɹ t ɪ ŋ
physics	f ɪ z ɪ k s
sulfur	s ʌ l f ə ɹ
acidic	ə s ɪ d ɪ k
fahrenheit	f ɛ ɹ ə n h aɪ t
springs	s p ɹ ɪ ŋ z
teton	t iː t ə n
speaker	s p iː k ə ɹ
sibling	s ɪ b l ɪ ŋ
psychiatrist	s ə k aɪ ə t ɹ ə s t
dib	d ɪ b
carolinas	k ɛ ɹ ə l aɪ n ə z
hurricanes	h ɜː ə k eɪ n z
random	ɹ æ n d ə m
institute	ɪ n s t ə t uː t
culinary	k j uː l ɪ n ɛ ɹ iː
announcements	ə n aʊ n s m ə n t s
whites	w aɪ t s
shortbread	ʃ ɔ t b ɹ ɛ d
lookout	l ʊ k aʊ t
dunked	d ʌ ŋ k t
moaning	m oʊ n ɪ ŋ
preferably	p ɹ ɛ f ə ɹ ə b l iː
puffy	p ʌ f iː
quicker	k w ɪ k ə ɹ
chill	tʃ ɪ l
yanking	j æ ŋ k ɪ ŋ
bipolar	b aɪ p oʊ l ə ɹ
deeply	d iː p l iː
government	ɡ ʌ v ə ɹ m ə n t
fired	f aɪ ə ɹ d
closely	k l oʊ s l iː
saucers	s ɔ s ə ɹ z
hellos	h ə l oʊ z
cordial	k ɔ ɹ dʒ ə l
knowledge	n ɑ l ə dʒ
scanty	s k æ n t iː
tiptoe	t ɪ p t oʊ
damaging	d æ m ɪ dʒ ɪ ŋ
triumphantly	t ɹ aɪ ʌ m f ə n t l iː
chuckling	tʃ ʌ k l ɪ ŋ
heels	h iː l z
dependable	d ɪ p ɛ n d ə b ə l
c's	s iː z
remarked	ɹ ɪ m ɑ ɹ k t
mistaken	m ɪ s t eɪ k ə n
abridged	ə b ɹ ɪ dʒ d
laney	l eɪ n iː
sparkled	s p ɑ ɹ k ə l d
squealed	s k w iː l d
fritz	f ɹ ɪ t s
interrupting	ɪ n t ə ɹ ʌ p t ɪ ŋ
scowled	s k aʊ l d
watercress	w ɔ t ə ɹ k ɹ ɛ s
bleated	b l iː t ɪ d
grassy	ɡ ɹ æ s iː
penelope	p ə n ɛ l ə p iː
friendship	f ɹ ɛ n d ʃ ɪ p
nerve	n ɜː v
sulking	s ʌ l k ɪ ŋ
coldly	k oʊ l d l iː
displaying	d ɪ s p l eɪ ɪ ŋ
selfish	s ɛ l f ɪ ʃ
frolicked	f ɹ ɑ l ɪ k t
romped	ɹ ɑ m p t
paddle	p æ d ə l
pizzas	p iː t s ə z
carb	k ɑ ɹ b
selections	s ə l ɛ k ʃ ə n z
serve	s ɜː v
sugary	ʃ ʊ ɡ ə ɹ iː
warms	w ɔ ɹ m z
audio	ɑ d iː oʊ
lego	l ɛ ɡ oʊ
fluoride	f l ʊ ɹ aɪ d
cuisinart	k w iː s ɪ n ə ɹ t
glen	ɡ l ɛ n
straighter	s t ɹ eɪ t ə ɹ
filthy	f ɪ l θ iː
saliva	s ə l aɪ v ə
rag	ɹ æ ɡ
clunking	k l ʌ ŋ k ɪ ŋ
ly	l aɪ
posies	p oʊ z ɪ z
abort	ə b ɔ ɹ t
constrictor	k ə n s t ɹ ɪ k t ə ɹ
guinea	ɡ ɪ n iː
kika	k ɪ k ə
talkative	t ɔ k ə t ɪ v
snuggling	s n ʌ ɡ l ɪ ŋ
littler	l ɪ t ə l ə ɹ
seated	s iː t ɪ d
delightful	d ɪ l aɪ t f ə l
pardon	p ɑ ɹ d ə n
labeled	l eɪ b ə l d
socket	s ɑ k ə t
receiver	ɹ ə s iː v ə ɹ
energetically	ɛ n ə ɹ dʒ ɛ t ɪ k l iː
pauses	p ɔ z ə z
briefest	b ɹ iː f ə s t
secs	s ɛ k s
tofu	t oʊ f uː
biscuit	b ɪ s k ə t
maney	m eɪ n iː
mey	m eɪ
alzheimer's	æ l z h aɪ m ə ɹ z
aspect	æ s p ɛ k t
data	d eɪ t ə
representing	ɹ ɛ p ɹ ɪ z ɛ n t ɪ ŋ
bossy	b ɔ s iː
ideal	aɪ d iː l
inducing	ɪ n d uː s ɪ ŋ
disguising	d ɪ s ɡ aɪ z ɪ ŋ
palatable	p æ l ə t ə b ə l
induce	ɪ n d uː s
savoring	s eɪ v ə ɹ ɪ ŋ
adjust	ə dʒ ʌ s t
combo	k ɑ m b oʊ
mikey	m aɪ k iː
bucky	b ʌ k iː
torturing	t ɔ ɹ tʃ ə ɹ ɪ ŋ
tortured	t ɔ ɹ tʃ ə ɹ d
key's	k iː z
critical	k ɹ ɪ t ɪ k ə l
gesundheit	ɡ ə z ʊ n d h aɪ t
channel	tʃ æ n ə l
liking	l aɪ k ɪ ŋ
sling	s l ɪ ŋ
sheepish	ʃ iː p ɪ ʃ
stale	s t eɪ l
when're	w ɛ n ə ə ɹ
testing	t ɛ s t ɪ ŋ
broker	b ɹ oʊ k ə ɹ
tenth	t ɛ n θ
transmitter	t ɹ æ n s m ɪ t ə ɹ
general	dʒ ɛ n ə ɹ ə l
st	s t ɹ iː t
bonnie	b ɑ n iː
shoveled	ʃ ʌ v ə l d
fifi	f iː f iː
replay	ɹ iː p l eɪ
session	s ɛ ʃ ə n
angus	æ ŋ ɡ ə s
nickname	n ɪ k n eɪ m
tested	t ɛ s t ɪ d
harness	h ɑ ɹ n ə s
jiggling	dʒ ɪ ɡ ə l ɪ ŋ
functioning	f ʌ ŋ k ʃ ə n ɪ ŋ
malfunction	m æ l f ʌ ŋ k ʃ ə n
hypothesis	h aɪ p ɑ θ ə s ə s
transmitters	t ɹ æ n s m ɪ t ə ɹ z
ambient	æ m b iː ə n t
trend	t ɹ ɛ n d
thingy	θ ɪ ŋ iː
der	d ɜː
confiscate	k ɑ n f ə s k eɪ t
seventeenth	s ɛ v ə n t iː n θ
spoonful	s p uː n f ʊ l
spending	s p ɛ n d ɪ ŋ
fussing	f ʌ s ɪ ŋ
kully	k ʌ l iː
universal	j uː n ə v ɜː s ə l
idiosyncratic	ɪ d iː oʊ s ɪ n k ɹ æ t ɪ k
horsy	h ɔ s ɪ
retrieve	ɹ ɪ t ɹ iː v
punchy	p ʌ n tʃ iː
maxie	m æ k s iː
taker	t eɪ k ə ɹ
bangle	b æ ŋ ɡ ə l
booties	b uː t iː z
mana	m ɑ n ə
kim	k ɪ m
stomping	s t ɑ m p ɪ ŋ
contexts	k ɑ n t ɛ k s t s
appropriately	ə p ɹ oʊ p ɹ iː ɪ t l iː
precarious	p ɹ iː k ɛ ɹ iː ə s
paged	p eɪ dʒ d
shrill	ʃ ɹ ɪ l
phooey	f uː iː
jackpot	dʒ æ k p ɑ t
kuck	k ʌ k
confine	k ə n f aɪ n
shredded	ʃ ɹ ɛ d ɪ d
grinder	ɡ ɹ aɪ n d ə ɹ
flax	f l æ k s
ricotta	ɹ iː k ɑ t ə
waddled	w ɑ d l d
shaky	ʃ eɪ k iː
tim	t ɪ m
asha	ɑ ʃ ə
dolly	d ɑ l iː
dolly's	d ɑ l iː z
tweeting	t w iː t ɪ ŋ
focused	f oʊ k ə s t
wheaties	w iː t iː z
swallowing	s w ɑ l oʊ ɪ ŋ
jalapenos	h æ l ə p iː n j oʊ z
accessible	æ k s ɛ s ə b ə l
convenient	k ə n v iː n j ə n t
negros	n iː ɡ ɹ oʊ z
funs	f ʌ n z
dionne	d iː ɑ n
germ	dʒ ɜː m
plaid	p l æ d
wheatie	w iː t iː
tablespoon	t eɪ b ə l s p uː n
absorb	ə b z ɔ ɹ b
bucy	b j uː s iː
preview	p ɹ iː v j uː
anxious	æ ŋ k ʃ ə s
eagle	iː ɡ ə l
clunked	k l ʌ ŋ k t
lucy's	l uː s iː z
seagull's	s iː ɡ ʌ l z
sushi	s uː ʃ iː
disposal	d ɪ s p oʊ z ə l
rainstorms	ɹ eɪ n s t ɔ ɹ m z
lucille	l uː s iː l
uni	j uː n iː
swill	s w ɪ l
korean	k ɔ ɹ iː ə n
tyler	t aɪ l ə ɹ
tyler's	t aɪ l ə ɹ z
flushing	f l ʌ ʃ ɪ ŋ
sands	s æ n d z
warmed	w ɔ ɹ m d
mets	m ɛ t s
brioche	b ɹ iː oʊ ʃ
chopsticks	tʃ ɑ p s t ɪ k s
require	ɹ iː k w aɪ ə ɹ
vigorous	v ɪ ɡ ə ɹ ə s
eighteenth	eɪ t iː n θ
conceive	k ə n s iː v
athlete	æ θ l iː t
ribbons	ɹ ɪ b ə n z
software	s ɔ f t w ɛ ɹ
massage	m ə s ɑ ʒ
access	æ k s ɛ s
professional	p ɹ ə f ɛ ʃ ə n ə l
cleaners	k l iː n ə ɹ z
clogs	k l ɑ ɡ z
sequence	s iː k w ə n s
alan	æ l ə n
cecilia	s ɪ s iː l j ə
fiend	f iː n d
earnest	ɜː n ɪ s t
flowers'	f l aʊ ə ɹ z
transition	t ɹ æ n z ɪ ʃ ə n
